{"anchors":{"max_profit":{"emissions":847.5,"profit":4625.0,"x":[50.0,0.0,38.75,0.0,32.5]},"min_emissions":{"emissions":240.0,"profit":1800.00000001,"x":[0.0,0.0,60.0,0.0,0.0]}},"compromise_index":10,"front":[{"emissions":240.0,"eps":240.0,"profit":1800.00000001,"x":[0.0,0.0,60.0,0.0,0.0]},{"emissions":270.375,"eps":270.375,"profit":1951.875,"x":[3.796875,0.0,60.0,0.0,0.0]},{"emissions":300.75,"eps":300.75,"profit":2103.75,"x":[7.59375,0.0,60.0,0.0,0.0]},{"emissions":331.125,"eps":331.125,"profit":2255.625,"x":[11.390625,0.0,60.0,0.0,0.0]},{"emissions":361.5,"eps":361.5,"profit":2407.5,"x":[15.1875,0.0,60.0,0.0,0.0]},{"emissions":391.875,"eps":391.875,"profit":2559.375,"x":[18.984375,0.0,60.0,0.0,0.0]},{"emissions":422.25,"eps":422.25,"profit":2711.25,"x":[22.78125,0.0,60.0,0.0,0.0]},{"emissions":452.625,"eps":452.625,"profit":2863.125,"x":[26.578125,0.0,60.0,0.0,0.0]},{"emissions":483.0,"eps":483.0,"profit":3015.0,"x":[30.375,0.0,60.0,0.0,0.0]},{"emissions":513.375,"eps":513.375,"profit":3166.875,"x":[34.171875,0.0,60.0,0.0,0.0]},{"emissions":543.75,"eps":543.75,"profit":3318.75,"x":[37.96875,0.0,60.0,0.0,0.0]},{"emissions":574.125,"eps":574.125,"profit":3470.625,"x":[25.875,0.0,60.0,0.0,14.125]},{"emissions":604.5,"eps":604.5,"profit":3619.28571429,"x":[0.0,0.0,59.67857143,0.0,40.64285714]},{"emissions":634.875,"eps":634.875,"profit":3749.46428571,"x":[0.0,0.0,57.50892857,0.0,44.98214286]},{"emissions":665.25,"eps":665.25,"profit":3876.04166667,"x":[5.04166667,0.0,54.97916667,0.0,45.0]},{"emissions":695.625,"eps":695.625,"profit":4002.60416667,"x":[10.10416667,0.0,52.44791667,0.0,45.0]},{"emissions":726.0,"eps":726.0,"profit":4129.16666667,"x":[15.16666667,0.0,49.91666667,0.0,45.0]},{"emissions":756.375,"eps":756.375,"profit":4255.72916667,"x":[20.22916667,0.0,47.38541667,0.0,45.0]},{"emissions":786.75,"eps":786.75,"profit":4382.29166667,"x":[25.29166667,0.0,44.85416667,0.0,45.0]},{"emissions":817.125,"eps":817.125,"profit":4508.85416667,"x":[30.35416667,0.0,42.32291667,0.0,45.0]},{"emissions":847.5,"eps":847.5,"profit":4625.0,"x":[50.0,0.0,38.75,0.0,32.5]}],"generated_at":"2026-10-11T00:00:00Z","problem":{"A":[[2.0,3.0,1.0,4.0,2.5],[1.0,2.0,2.0,3.0,1.0],[3.0,2.0,1.0,4.0,2.0]],"b":[220.0,160.0,260.0],"constraint_note":"rows: A x <= b; plus sum(x) >= q_min; 0 <= x <= upper","emissions":[8.0,12.0,4.0,20.0,9.0],"objectives":{"emissions":"minimize","profit":"maximize"},"products":["Standard","Premium","Eco","Luxury","Bulk"],"profit":[40.0,55.0,30.0,70.0,45.0],"q_min":60.0,"resources":["labor_hours","machine_hours","material_units"],"upper":[50.0,40.0,60.0,30.0,45.0]},"schema_version":"v1","spec":{"compromise":"front point closest to the utopia corner in range-normalized units; one choice among many, not 'the' answer","cross_check":{"scipy_linprog_max_abs_profit_diff":0.0},"docstring":"analytics/lp.py","grid":"21 epsilons (K=20) between the two lexicographic anchors","method":"epsilon-constraint on a continuous LP; solver HiGHS (highspy here, highs-js in the browser)"},"tags":{"anchors":"DERIVED","front":"DERIVED","problem":"SYNTHETIC","vectors":"DERIVED"},"tolerance":{"abs":1e-06,"note":"objective values only; the optimal x may be non-unique at kinks","rel":1e-07},"vectors":[{"e_hi":637.5,"e_lo":240.0,"eps_profit":[[240.0,1800.00000001],[339.375,2296.875],[438.75,2793.75],[538.125,3290.625],[637.5,3725.0]],"labor_hours":160.0,"profit_at_e_hi":3725.0,"profit_at_e_lo":1800.00000001},{"e_hi":742.5,"e_lo":240.0,"eps_profit":[[240.0,1800.00000001],[365.625,2428.125],[491.25,3056.25],[616.875,3672.32142857],[742.5,4175.0]],"labor_hours":190.0,"profit_at_e_hi":4175.0,"profit_at_e_lo":1800.00000001},{"e_hi":847.5,"e_lo":240.0,"eps_profit":[[240.0,1800.00000001],[391.875,2559.375],[543.75,3318.75],[695.625,4002.60416667],[847.5,4625.0]],"labor_hours":220.0,"profit_at_e_hi":4625.0,"profit_at_e_lo":1800.00000001},{"e_hi":955.0,"e_lo":240.0,"eps_profit":[[240.0,1800.00000001],[418.75,2693.75],[597.5,3587.5],[776.25,4338.54166667],[955.0,5008.92857143]],"labor_hours":250.0,"profit_at_e_hi":5008.92857143,"profit_at_e_lo":1800.00000001}]}